Const,Your Rating,Date Rated,Title,URL,Title Type,IMDb Rating,Runtime (mins),Year,Genres,Num Votes,Release Date,Directors
tt0298130,5,2016-02-15,The Ring,https://www.imdb.com/title/tt0298130/,movie,7.1,115,2002,"Horror, Mystery",367995,2002-10-02,Gore Verbinski
tt0298148,8,2015-01-25,Shrek 2,https://www.imdb.com/title/tt0298148/,movie,7.3,93,2004,"Animation, Adventure, Comedy, Family, Fantasy, Romance",492161,2004-05-08,"Conrad Vernon, Kelly Asbury, Andrew Adamson"
tt0298203,5,2015-01-25,8 Mile,https://www.imdb.com/title/tt0298203/,movie,7.2,110,2002,"Drama, Music",311490,2002-09-08,Curtis Hanson
tt3014284,6,2018-08-07,The Lego Ninjago Movie,https://www.imdb.com/title/tt3014284/,movie,6.0,101,2017,"Animation, Action, Adventure, Comedy, Drama, Family, Fantasy, Sci-Fi, Thriller",29076,2017-09-20,"Paul Fisher, Bob Logan, Charlie Bean"
tt3032476,9,2016-01-28,Better Call Saul,https://www.imdb.com/title/tt3032476/,tvSeries,9.0,3154,2015,"Crime, Drama",613764,2015-02-08,
tt3040964,8,2017-01-02,The Jungle Book,https://www.imdb.com/title/tt3040964/,movie,7.4,106,2016,"Adventure, Drama, Family, Fantasy",287684,2016-04-04,Jon Favreau
tt0304141,5,2015-01-25,Harry Potter and the Prisoner of Azkaban,https://www.imdb.com/title/tt0304141/,movie,7.9,142,2004,"Adventure, Family, Fantasy, Mystery",671387,2004-05-23,Alfonso Cuarón
tt0304415,4,2016-08-14,Mona Lisa Smile,https://www.imdb.com/title/tt0304415/,movie,6.5,117,2003,Drama,88058,2003-12-19,Mike Newell
tt0304669,2,2015-01-25,The Santa Clause 2,https://www.imdb.com/title/tt0304669/,movie,5.7,104,2002,"Comedy, Family, Fantasy",61556,2002-10-27,Michael Lembeck
tt3060952,7,2015-01-25,Justice League: War,https://www.imdb.com/title/tt3060952/,video,7.2,79,2014,"Animation, Action, Adventure, Drama, Fantasy, Sci-Fi",36795,2014-02-04,Jay Oliva
tt3065204,6,2021-01-25,The Conjuring 2,https://www.imdb.com/title/tt3065204/,movie,7.3,134,2016,"Horror, Mystery, Thriller",292811,2016-05-13,James Wan
tt0307453,4,2015-01-25,Shark Tale,https://www.imdb.com/title/tt0307453/,movie,6.0,90,2004,"Animation, Adventure, Comedy, Family, Thriller",194670,2004-09-10,"Bibo Bergeron, Vicky Jenson, Rob Letterman"
tt3076658,8,2022-07-11,Creed,https://www.imdb.com/title/tt3076658/,movie,7.6,133,2015,"Action, Drama, Sport",304364,2015-11-19,Ryan Coogler
tt3079380,7,2016-04-20,Spy,https://www.imdb.com/title/tt3079380/,movie,7.0,120,2015,"Action, Comedy",254605,2015-03-15,Paul Feig
tt0310460,7,2022-03-01,George Lopez,https://www.imdb.com/title/tt0310460/,tvSeries,6.9,30,2002,"Comedy, Drama",12953,2002-03-27,
tt3104988,7,2018-11-25,Crazy Rich Asians,https://www.imdb.com/title/tt3104988/,movie,6.9,120,2018,"Comedy, Drama, Romance",184572,2018-08-07,Jon M. Chu
tt3107288,8,2015-01-27,The Flash,https://www.imdb.com/title/tt3107288/,tvSeries,7.5,43,2014,"Action, Adventure, Drama, Sci-Fi",364156,2014-10-07,
tt0311289,7,2018-07-10,Holes,https://www.imdb.com/title/tt0311289/,movie,7.0,117,2003,"Adventure, Comedy, Drama, Family, Mystery",97174,2003-04-11,Andrew Davis
tt0312004,8,2015-07-07,The Curse of the Were-Rabbit,https://www.imdb.com/title/tt0312004/,movie,7.5,85,2005,"Animation, Adventure, Comedy, Family, Fantasy, Mystery, Sci-Fi",143378,2005-09-04,"Steve Box, Nick Park"
tt0312109,6,2016-02-17,Codename: Kids Next Door,https://www.imdb.com/title/tt0312109/,tvSeries,7.2,23,2002,"Animation, Action, Adventure, Comedy, Family, Sci-Fi",22134,2002-12-06,
tt0312172,6,2015-01-27,Monk,https://www.imdb.com/title/tt0312172/,tvSeries,8.1,44,2002,"Comedy, Crime, Drama, Mystery",80961,2002-07-12,
tt3139072,5,2015-01-25,Son of Batman,https://www.imdb.com/title/tt3139072/,video,6.7,74,2014,"Animation, Action, Adventure, Crime, Drama, Fantasy, Mystery",30471,2014-04-22,Ethan Spaulding
tt3139086,6,2016-07-29,Batman: Assault on Arkham,https://www.imdb.com/title/tt3139086/,video,7.4,76,2014,"Animation, Action, Adventure, Crime, Fantasy, Sci-Fi, Thriller",37095,2014-07-25,"Jay Oliva, Ethan Spaulding"
tt3152624,7,2016-04-19,Trainwreck,https://www.imdb.com/title/tt3152624/,movie,6.2,125,2015,"Comedy, Drama, Romance",140930,2015-07-10,Judd Apatow
tt0316654,9,2018-06-26,Spider-Man 2,https://www.imdb.com/title/tt0316654/,movie,7.5,127,2004,"Action, Adventure, Sci-Fi",689847,2004-06-25,Sam Raimi
tt0031679,6,2015-01-25,Mr. Smith Goes to Washington,https://www.imdb.com/title/tt0031679/,movie,8.1,129,1939,"Comedy, Drama",119494,1939-10-17,Frank Capra
tt3170832,9,2016-01-29,Room,https://www.imdb.com/title/tt3170832/,movie,8.1,118,2015,"Drama, Thriller",440659,2015-09-04,Lenny Abrahamson
tt0317219,8,2015-01-25,Cars,https://www.imdb.com/title/tt0317219/,movie,7.2,117,2006,"Animation, Adventure, Comedy, Family, Sport",452993,2006-03-14,"John Lasseter, Joe Ranft"
tt0317705,10,2015-07-06,The Incredibles,https://www.imdb.com/title/tt0317705/,movie,8.0,115,2004,"Animation, Action, Adventure, Family",784387,2004-10-27,Brad Bird
tt0318155,5,2016-10-23,Looney Tunes: Back in Action,https://www.imdb.com/title/tt0318155/,movie,5.8,93,2003,"Animation, Adventure, Comedy, Family",39684,2003-11-09,"Joe Dante, Eric Goldberg"
tt0318233,4,2016-08-14,My Life as a Teenage Robot,https://www.imdb.com/title/tt0318233/,tvSeries,7.0,23,1999,"Animation, Action, Adventure, Comedy, Family, Sci-Fi",10860,1999-01-05,
tt3183660,9,2016-11-25,Fantastic Beasts and Where to Find Them,https://www.imdb.com/title/tt3183660/,movie,7.2,132,2016,"Adventure, Family, Fantasy",497087,2016-11-08,David Yates
tt0318403,5,2015-01-25,The Lion King 1½,https://www.imdb.com/title/tt0318403/,video,6.5,77,2004,"Animation, Adventure, Comedy, Family, Musical",44749,2004-02-10,Bradley Raymond
tt3189976,8,2021-08-30,Gravity Falls Shorts,https://www.imdb.com/title/tt3189976/,tvSeries,8.3,2,2013,"Animation, Short, Adventure, Comedy, Family, Fantasy, Mystery",3093,2013-10-14,
tt0319343,6,2015-01-25,Elf,https://www.imdb.com/title/tt0319343/,movie,7.1,97,2003,"Adventure, Comedy, Family, Fantasy, Romance",291190,2003-10-09,Jon Favreau
tt0319931,4,2015-01-27,American Idol: The Search for a Superstar,https://www.imdb.com/title/tt0319931/,tvSeries,4.3,42,2002,"Documentary, Game-Show, Music, Reality-TV",22072,2002-06-11,
tt0320808,7,2016-02-02,"The Adventures of Jimmy Neutron, Boy Genius",https://www.imdb.com/title/tt0320808/,tvSeries,6.7,24,2002,"Animation, Adventure, Comedy, Family, Sci-Fi",23617,2002-07-20,
tt0032138,7,2015-01-25,The Wizard of Oz,https://www.imdb.com/title/tt0032138/,movie,8.1,102,1939,"Adventure, Family, Fantasy, Musical",418794,1939-08-10,"King Vidor, Victor Fleming"
tt3216586,4,2018-06-05,The Brink,https://www.imdb.com/title/tt3216586/,tvSeries,7.7,30,2015,Comedy,14609,2015-06-21,
tt0322330,5,2015-01-25,Freaky Friday,https://www.imdb.com/title/tt0322330/,movie,6.3,97,2003,"Comedy, Family, Fantasy, Music, Romance",148743,2003-08-04,Mark Waters
tt3228774,7,2021-06-01,Cruella,https://www.imdb.com/title/tt3228774/,movie,7.3,134,2021,"Adventure, Comedy, Crime, Drama",255137,2021-05-18,Craig Gillespie
tt0322968,10,2017-11-23,Kingdom Hearts,https://www.imdb.com/title/tt0322968/,videoGame,9.2,,2002,"Action, Adventure, Family, Fantasy",7740,2002-03-28,Tetsuya Nomura
tt3230454,7,2015-05-15,The Last Man on Earth,https://www.imdb.com/title/tt3230454/,tvSeries,7.4,22,2015,"Action, Comedy, Drama, Romance, Sci-Fi",62445,2015-03-01,
tt0323250,7,2015-09-04,Mike's New Car,https://www.imdb.com/title/tt0323250/,video,7.0,4,2002,"Animation, Short, Comedy, Family, Fantasy",14719,2002-05-24,"Pete Docter, Roger Gould"
tt3235888,7,2015-08-23,It Follows,https://www.imdb.com/title/tt3235888/,movie,6.8,100,2014,"Horror, Mystery, Thriller",261215,2014-05-17,David Robert Mitchell
tt0325980,9,2020-08-09,Pirates of the Caribbean: The Curse of the Black Pearl,https://www.imdb.com/title/tt0325980/,movie,8.1,143,2003,"Action, Adventure, Fantasy",1180954,2003-06-28,Gore Verbinski
tt0327679,5,2015-01-25,Ella Enchanted,https://www.imdb.com/title/tt0327679/,movie,6.3,96,2004,"Comedy, Family, Fantasy, Romance",72707,2004-04-09,Tommy O'Haver
tt3278316,6,2015-01-27,The Pete Holmes Show,https://www.imdb.com/title/tt3278316/,tvSeries,7.2,,2013,"Comedy, Talk-Show",629,2013-10-28,
tt3279494,7,2016-02-15,@midnight,https://www.imdb.com/title/tt3279494/,tvSeries,7.7,30,2013,"Comedy, Game-Show",2184,2013-10-21,
tt0328880,5,2015-01-25,Brother Bear,https://www.imdb.com/title/tt0328880/,movie,6.8,85,2003,"Animation, Adventure, Comedy, Drama, Family, Fantasy, Musical",120108,2003-10-20,"Aaron Blaise, Robert Walker"
tt0032910,6,2015-01-25,Pinocchio,https://www.imdb.com/title/tt0032910/,movie,7.5,88,1940,"Animation, Adventure, Comedy, Family, Fantasy, Musical",156226,1940-02-07,"Ben Sharpsteen, Jack Kinney, Hamilton Luske, Wilfred Jackson, T. Hee, Norman Ferguson, Bill Roberts"
tt0330373,5,2015-01-25,Harry Potter and the Goblet of Fire,https://www.imdb.com/title/tt0330373/,movie,7.7,157,2005,"Adventure, Family, Fantasy, Mystery",662266,2005-11-06,Mike Newell
tt3315342,10,2023-09-25,Logan,https://www.imdb.com/title/tt3315342/,movie,8.1,137,2017,"Action, Drama, Sci-Fi, Thriller",808497,2017-02-17,James Mangold
tt0331632,5,2021-08-05,Scooby-Doo 2: Monsters Unleashed,https://www.imdb.com/title/tt0331632/,movie,5.2,93,2004,"Adventure, Comedy, Family, Fantasy, Horror, Mystery, Sci-Fi",63167,2004-03-20,Raja Gosnell
tt3316960,8,2016-02-13,Still Alice,https://www.imdb.com/title/tt3316960/,movie,7.5,101,2014,Drama,141418,2014-09-08,"Richard Glatzer, Wash Westmoreland"
tt3322310,8,2017-03-31,Iron Fist,https://www.imdb.com/title/tt3322310/,tvSeries,6.4,55,2017,"Action, Adventure, Crime, Fantasy, Sci-Fi",137187,2017-03-15,
tt3322312,9,2015-04-28,Daredevil,https://www.imdb.com/title/tt3322312/,tvSeries,8.6,54,2015,"Action, Crime, Drama, Fantasy, Sci-Fi, Thriller",463372,2015-04-02,
tt3322314,9,2016-10-13,Luke Cage,https://www.imdb.com/title/tt3322314/,tvSeries,7.3,55,2016,"Action, Crime, Drama, Sci-Fi, Thriller",137235,2016-09-28,
tt3323254,6,2016-04-11,Bordertown,https://www.imdb.com/title/tt3323254/,tvSeries,5.5,21,2016,"Animation, Comedy",3208,2016-01-03,
tt0332379,7,2015-01-25,School of Rock,https://www.imdb.com/title/tt0332379/,movie,7.2,109,2003,"Comedy, Music",322354,2003-09-09,Richard Linklater
tt3330488,8,2017-09-18,Middle-Earth: Shadow of Mordor,https://www.imdb.com/title/tt3330488/,videoGame,8.2,,2014,"Action, Adventure, Fantasy",6240,2014-09-30,"Christian Cantamessa, Matthew Allen, Liam O'Brien, Nathan Hendrickson, Neil Huxley"
tt0033467,4,2011-12-22,Citizen Kane,https://www.imdb.com/title/tt0033467/,movie,8.3,119,1941,"Drama, Mystery",458155,1941-05-01,Orson Welles
tt0338094,4,2018-08-14,The Haunted Mansion,https://www.imdb.com/title/tt0338094/,movie,5.2,99,2003,"Comedy, Family, Fantasy, Horror, Mystery",55717,2003-11-26,Rob Minkoff
tt0338348,4,2015-01-25,The Polar Express,https://www.imdb.com/title/tt0338348/,movie,6.6,100,2004,"Animation, Adventure, Comedy, Family, Fantasy, Musical",227685,2004-10-21,Robert Zemeckis
tt3385516,7,2017-03-06,X-Men: Apocalypse,https://www.imdb.com/title/tt3385516/,movie,6.9,144,2016,"Action, Adventure, Sci-Fi",453103,2016-05-09,Bryan Singer
tt0033870,7,2015-01-25,The Maltese Falcon,https://www.imdb.com/title/tt0033870/,movie,8.0,100,1941,"Crime, Film-Noir, Mystery, Romance",164270,1941-10-03,John Huston
tt0343314,8,2018-08-01,Teen Titans,https://www.imdb.com/title/tt0343314/,tvSeries,7.9,30,2003,"Animation, Action, Adventure, Comedy, Family, Fantasy, Sci-Fi",36515,2003-07-19,
tt0343660,7,2016-08-14,50 First Dates,https://www.imdb.com/title/tt0343660/,movie,6.8,99,2004,"Comedy, Drama, Romance",373322,2004-02-03,Peter Segal
tt0343818,5,2015-01-25,"I, Robot",https://www.imdb.com/title/tt0343818/,movie,7.1,115,2004,"Action, Mystery, Sci-Fi, Thriller",564552,2004-07-07,Alex Proyas
tt3444938,8,2015-07-13,The Tonight Show Starring Jimmy Fallon,https://www.imdb.com/title/tt3444938/,tvSeries,7.1,60,2014,"Comedy, Music, Talk-Show",18772,2014-02-17,
tt0034492,5,2015-01-25,Bambi,https://www.imdb.com/title/tt0034492/,movie,7.3,69,1942,"Animation, Adventure, Drama, Family",150959,1942-08-09,"Samuel Armstrong, Paul Satterfield, Graham Heid, James Algar, David Hand, Clyde Geronimi, Arthur Davis, Bill Roberts, Norman Wright"
tt3450958,8,2017-07-25,War for the Planet of the Apes,https://www.imdb.com/title/tt3450958/,movie,7.4,140,2017,"Action, Adventure, Drama, Sci-Fi, Thriller",273023,2017-07-07,Matt Reeves
tt0034583,7,2015-01-25,Casablanca,https://www.imdb.com/title/tt0034583/,movie,8.5,102,1942,"Drama, Romance, War",594551,1942-11-26,Michael Curtiz
tt0345950,7,2015-01-25,The SpongeBob SquarePants Movie,https://www.imdb.com/title/tt0345950/,movie,7.1,87,2004,"Animation, Adventure, Comedy, Family, Fantasy",99258,2004-11-14,"Stephen Hillenburg, Mark Osborne"
tt0347149,8,2015-01-29,Hauru no ugoku shiro,https://www.imdb.com/title/tt0347149/,movie,8.2,119,2004,"Animation, Adventure, Family, Fantasy",428451,2004-09-05,Hayao Miyazaki
tt3480822,7,2021-07-13,Black Widow,https://www.imdb.com/title/tt3480822/,movie,6.7,134,2021,"Action, Adventure, Sci-Fi",411150,2021-06-30,Cate Shortland
tt3484406,7,2022-12-29,The Jim Gaffigan Show,https://www.imdb.com/title/tt3484406/,tvSeries,7.5,30,2015,Comedy,2747,2015-07-14,
tt3487356,8,2018-11-19,Black-ish,https://www.imdb.com/title/tt3487356/,tvSeries,7.3,22,2014,Comedy,25008,2014-09-24,
tt0349205,4,2015-01-25,Cheaper by the Dozen,https://www.imdb.com/title/tt0349205/,movie,5.9,98,2003,"Comedy, Family",107123,2003-11-22,Shawn Levy
tt3498820,9,2016-05-06,Captain America: Civil War,https://www.imdb.com/title/tt3498820/,movie,7.8,147,2016,"Action, Sci-Fi",830627,2016-04-12,"Anthony Russo, Joe Russo"
tt3501632,8,2017-11-08,Thor: Ragnarok,https://www.imdb.com/title/tt3501632/,movie,7.9,130,2017,"Action, Adventure, Comedy, Fantasy, Sci-Fi",796712,2017-10-10,Taika Waititi
tt0351283,6,2015-01-25,Madagascar,https://www.imdb.com/title/tt0351283/,movie,6.9,86,2005,"Animation, Adventure, Comedy, Family",426514,2005-05-25,"Tom McGrath, Eric Darnell"
tt3513388,9,2023-10-12,Late Night with Seth Meyers,https://www.imdb.com/title/tt3513388/,tvSeries,6.3,60,2014,"Comedy, Talk-Show",7700,2014-02-24,
tt3513498,8,2019-11-06,The Lego Movie 2: The Second Part,https://www.imdb.com/title/tt3513498/,movie,6.6,107,2019,"Animation, Action, Adventure, Comedy, Family, Fantasy, Musical, Sci-Fi",74365,2019-02-02,Mike Mitchell
tt3513500,7,2022-05-22,Chip 'n Dale: Rescue Rangers,https://www.imdb.com/title/tt3513500/,movie,7.0,97,2022,"Action, Adventure, Comedy, Crime, Family, Fantasy, Mystery, Sci-Fi",45545,2022-05-20,Akiva Schaffer
tt3521126,8,2017-12-20,The Disaster Artist,https://www.imdb.com/title/tt3521126/,movie,7.3,104,2017,"Biography, Comedy, Drama",161375,2017-09-11,James Franco
tt3521164,8,2017-07-25,Moana,https://www.imdb.com/title/tt3521164/,movie,7.6,107,2016,"Animation, Adventure, Comedy, Family, Fantasy, Musical",363915,2016-11-14,"Don Hall, Ron Clements, John Musker, Chris Williams"
tt3530232,10,2015-01-27,Last Week Tonight with John Oliver,https://www.imdb.com/title/tt3530232/,tvSeries,8.9,30,2014,"Comedy, News, Talk-Show",93704,2014-04-27,
tt3554580,10,2017-09-18,Batman: Arkham Knight,https://www.imdb.com/title/tt3554580/,videoGame,9.0,,2015,"Action, Crime, Mystery, Sci-Fi, Thriller",22574,2015-06-23,Sefton Hill
tt0356470,5,2015-01-25,A Cinderella Story,https://www.imdb.com/title/tt0356470/,movie,5.9,95,2004,"Comedy, Family, Romance",92286,2004-07-10,Mark Rosman
tt0356680,3,2020-12-02,The Family Stone,https://www.imdb.com/title/tt0356680/,movie,6.3,103,2005,"Comedy, Drama, Romance",71779,2005-11-26,Thomas Bezucha
tt0357413,7,2015-01-25,Anchorman: The Legend of Ron Burgundy,https://www.imdb.com/title/tt0357413/,movie,7.1,94,2004,Comedy,372688,2004-06-09,Adam McKay
tt3578794,7,2016-02-06,Robot Chicken DC Comics Special II: Villains in Paradise,https://www.imdb.com/title/tt3578794/,tvMovie,7.6,22,2014,"Animation, Action, Comedy",1105,2014-04-06,"Seth Green, Zeb Wells"
tt0358082,3,2016-08-14,Robots,https://www.imdb.com/title/tt0358082/,movie,6.4,91,2005,"Animation, Adventure, Comedy, Family, Romance, Sci-Fi",158039,2005-03-10,"Chris Wedge, Carlos Saldanha"
tt3581920,10,2023-03-13,The Last of Us,https://www.imdb.com/title/tt3581920/,tvSeries,8.8,50,2023,"Action, Adventure, Drama, Horror, Sci-Fi, Thriller",466296,2023-01-15,
tt0358273,7,2021-01-14,Walk the Line,https://www.imdb.com/title/tt0358273/,movie,7.8,136,2005,"Biography, Drama, Music, Romance",261348,2005-09-04,James Mangold
tt3606752,6,2018-11-24,Cars 3,https://www.imdb.com/title/tt3606752/,movie,6.7,102,2017,"Animation, Adventure, Comedy, Family, Sport",115020,2017-06-10,Brian Fee
tt3606756,9,2018-06-26,Incredibles 2,https://www.imdb.com/title/tt3606756/,movie,7.6,118,2018,"Animation, Action, Adventure, Comedy, Family, Sci-Fi",320072,2018-06-05,Brad Bird
tt0360717,5,2016-08-14,King Kong,https://www.imdb.com/title/tt0360717/,movie,7.2,187,2005,"Action, Adventure, Romance",439368,2005-12-05,Peter Jackson
tt0361748,6,2016-08-14,Inglourious Basterds,https://www.imdb.com/title/tt0361748/,movie,8.4,153,2009,"Adventure, Drama, War",1535725,2009-05-20,Quentin Tarantino
tt0363328,8,2015-01-27,Drake & Josh,https://www.imdb.com/title/tt0363328/,tvSeries,7.7,23,2004,"Comedy, Family",42457,2004-01-11,
tt0363771,6,2015-01-25,"The Chronicles of Narnia: The Lion, the Witch and the Wardrobe",https://www.imdb.com/title/tt0363771/,movie,6.9,143,2005,"Adventure, Family, Fantasy",417519,2005-12-07,Andrew Adamson
tt3640424,8,2017-07-25,Allied,https://www.imdb.com/title/tt3640424/,movie,7.1,124,2016,"Action, Drama, Romance, Thriller, War",165247,2016-11-13,Robert Zemeckis
tt0364725,7,2016-08-14,Dodgeball: A True Underdog Story,https://www.imdb.com/title/tt0364725/,movie,6.7,92,2004,"Comedy, Sport",262198,2004-06-18,Rawson Marshall Thurber
tt0365748,7,2023-07-10,Shaun of the Dead,https://www.imdb.com/title/tt0365748/,movie,7.9,99,2004,"Comedy, Horror",582375,2004-03-29,Edgar Wright
tt3659388,8,2016-02-11,The Martian,https://www.imdb.com/title/tt3659388/,movie,8.0,144,2015,"Adventure, Drama, Sci-Fi",899353,2015-09-11,Ridley Scott
tt0366005,8,2015-01-27,Danny Phantom,https://www.imdb.com/title/tt0366005/,tvSeries,7.2,30,2003,"Animation, Action, Adventure, Comedy, Family, Fantasy, Horror, Sci-Fi",20064,2003-05-30,
tt0366548,5,2015-01-25,Happy Feet,https://www.imdb.com/title/tt0366548/,movie,6.4,108,2006,"Animation, Adventure, Comedy, Family, Music, Musical, Romance",196065,2006-11-12,"Warren Coleman, Judy Morris, George Miller"
tt0367594,3,2015-01-25,Charlie and the Chocolate Factory,https://www.imdb.com/title/tt0367594/,movie,6.7,115,2005,"Adventure, Comedy, Family, Fantasy, Musical",509340,2005-07-10,Tim Burton
tt0367882,3,2015-01-25,Indiana Jones and the Kingdom of the Crystal Skull,https://www.imdb.com/title/tt0367882/,movie,6.2,122,2008,"Action, Adventure",483002,2008-05-18,Steven Spielberg
tt0368891,6,2015-05-11,National Treasure,https://www.imdb.com/title/tt0368891/,movie,6.9,131,2004,"Action, Adventure, Mystery, Thriller",348323,2004-11-08,Jon Turteltaub
tt3689498,8,2015-01-29,Feast,https://www.imdb.com/title/tt3689498/,short,8.2,6,2014,"Animation, Short, Comedy, Drama, Family, Romance",23780,2014-06-10,Patrick Osborne
tt0369610,6,2015-06-18,Jurassic World,https://www.imdb.com/title/tt0369610/,movie,6.9,124,2015,"Action, Adventure, Sci-Fi",668099,2015-05-29,Colin Trevorrow
tt3697842,7,2016-08-14,The Late Show with Stephen Colbert,https://www.imdb.com/title/tt3697842/,tvSeries,7.2,41,2015,"Comedy, Talk-Show",14554,2015-09-08,
tt0371606,1,2015-01-25,Chicken Little,https://www.imdb.com/title/tt0371606/,movie,5.7,81,2005,"Animation, Adventure, Comedy, Family, Fantasy, Sci-Fi",98544,2005-10-06,Mark Dindal
tt0371746,8,2015-01-25,Iron Man,https://www.imdb.com/title/tt0371746/,movie,7.9,126,2008,"Action, Adventure, Sci-Fi",1102327,2008-04-14,Jon Favreau
tt3722332,5,2016-08-14,The Nightly Show with Larry Wilmore,https://www.imdb.com/title/tt3722332/,tvSeries,5.8,22,2015,"Comedy, News, Talk-Show",2955,2015-01-19,
tt0372784,8,2015-01-25,Batman Begins,https://www.imdb.com/title/tt0372784/,movie,8.2,140,2005,"Action, Crime, Drama",1542410,2005-05-31,Christopher Nolan
tt3731562,6,2021-01-26,Kong: Skull Island,https://www.imdb.com/title/tt3731562/,movie,6.7,118,2017,"Action, Adventure, Fantasy, Sci-Fi",337180,2017-01-02,Jordan Vogt-Roberts
tt0373889,6,2015-01-25,Harry Potter and the Order of the Phoenix,https://www.imdb.com/title/tt0373889/,movie,7.5,138,2007,"Action, Adventure, Family, Fantasy, Mystery",615404,2007-06-28,David Yates
tt3741700,6,2021-01-27,Godzilla: King of the Monsters,https://www.imdb.com/title/tt3741700/,movie,6.0,132,2019,"Action, Adventure, Fantasy, Sci-Fi",196077,2019-05-29,Michael Dougherty
tt3741834,8,2017-02-20,Lion,https://www.imdb.com/title/tt3741834/,movie,8.0,118,2016,"Biography, Drama",246367,2016-09-10,Garth Davis
tt3748528,8,2016-12-17,Rogue One,https://www.imdb.com/title/tt3748528/,movie,7.8,133,2016,"Action, Adventure, Sci-Fi",671658,2016-12-10,Gareth Edwards
tt0374900,3,2015-01-25,Napoleon Dynamite,https://www.imdb.com/title/tt0374900/,movie,7.0,96,2004,Comedy,232207,2004-01-17,Jared Hess
tt3749900,4,2016-01-22,Gotham,https://www.imdb.com/title/tt3749900/,tvSeries,7.8,42,2014,"Action, Crime, Drama, Mystery, Sci-Fi, Thriller",237848,2014-07-26,
tt0376994,4,2016-02-13,X-Men: The Last Stand,https://www.imdb.com/title/tt0376994/,movie,6.6,104,2006,"Action, Adventure, Sci-Fi",533183,2006-05-22,Brett Ratner
tt0377092,7,2015-01-25,Mean Girls,https://www.imdb.com/title/tt0377092/,movie,7.1,97,2004,Comedy,413264,2004-04-19,Mark Waters
tt3774114,7,2016-09-18,Snowden,https://www.imdb.com/title/tt3774114/,movie,7.3,134,2016,"Biography, Crime, Drama, Thriller",159819,2016-07-21,Oliver Stone
tt3778644,6,2018-06-03,Solo: A Star Wars Story,https://www.imdb.com/title/tt3778644/,movie,6.9,135,2018,"Action, Adventure, Sci-Fi",370065,2018-05-10,Ron Howard
tt3783958,9,2020-01-15,La La Land,https://www.imdb.com/title/tt3783958/,movie,8.0,128,2016,"Comedy, Drama, Music, Musical, Romance",639894,2016-08-31,Damien Chazelle
tt3794354,6,2022-03-22,Sonic the Hedgehog,https://www.imdb.com/title/tt3794354/,movie,6.5,99,2020,"Action, Adventure, Comedy, Family, Fantasy, Sci-Fi",153772,2020-01-25,Jeff Fowler
tt0379623,7,2016-02-29,Ellen: The Ellen DeGeneres Show,https://www.imdb.com/title/tt0379623/,tvSeries,6.7,60,2003,"Comedy, Talk-Show",17457,2003-09-08,
tt0381061,8,2016-12-21,Casino Royale,https://www.imdb.com/title/tt0381061/,movie,8.0,144,2006,"Action, Adventure, Thriller",681898,2006-11-14,Martin Campbell
tt3824386,8,2020-05-05,Lava,https://www.imdb.com/title/tt3824386/,short,7.2,7,2014,"Animation, Short, Family, Fantasy, Music, Musical, Romance",18879,2014-10-10,James Ford Murphy
tt0382932,10,2017-11-23,Ratatouille,https://www.imdb.com/title/tt0382932/,movie,8.1,111,2007,"Animation, Adventure, Comedy, Family, Fantasy",794800,2007-06-22,"Brad Bird, Jan Pinkava"
tt0383126,8,2016-02-29,MythBusters,https://www.imdb.com/title/tt0383126/,tvSeries,8.3,48,2003,"Documentary, Mystery, Reality-TV",54215,2003-01-23,
tt0383216,2,2015-01-25,The Pink Panther,https://www.imdb.com/title/tt0383216/,movie,5.7,93,2006,"Adventure, Comedy, Crime, Mystery",90944,2006-01-19,Shawn Levy
tt0383574,6,2015-01-25,Pirates of the Caribbean: Dead Man's Chest,https://www.imdb.com/title/tt0383574/,movie,7.4,151,2006,"Action, Adventure, Fantasy",751360,2006-06-24,Gore Verbinski
tt0384793,4,2015-01-25,Accepted,https://www.imdb.com/title/tt0384793/,movie,6.4,93,2006,Comedy,138379,2006-08-18,Steve Pink
tt0038650,9,2020-11-29,It's a Wonderful Life,https://www.imdb.com/title/tt0038650/,movie,8.6,130,1946,"Drama, Family, Fantasy, Romance",481540,1946-12-20,Frank Capra
tt0386676,9,2015-01-27,The Office,https://www.imdb.com/title/tt0386676/,tvSeries,9.0,22,2005,Comedy,674727,2005-03-24,
tt0386789,8,2018-06-05,The Simpsons: Hit & Run,https://www.imdb.com/title/tt0386789/,videoGame,8.3,,2003,"Animation, Action, Adventure, Comedy, Crime, Mystery, Sci-Fi",2885,2003-09-16,
tt0388595,5,2015-01-27,Extreme Makeover: Home Edition,https://www.imdb.com/title/tt0388595/,tvSeries,6.3,60,2003,"Comedy, Drama, Family, Reality-TV",4822,2003-12-03,
tt3890160,10,2019-12-15,Baby Driver,https://www.imdb.com/title/tt3890160/,movie,7.6,113,2017,"Action, Crime, Drama, Music",586662,2017-03-11,Edgar Wright
tt3895884,6,2015-07-13,7 Days in Hell,https://www.imdb.com/title/tt3895884/,tvMovie,7.1,43,2015,"Comedy, Sport",19891,2015-03-13,Jake Szymanski
tt3896198,8,2017-05-20,Guardians of the Galaxy Vol. 2,https://www.imdb.com/title/tt3896198/,movie,7.6,136,2017,"Action, Adventure, Comedy, Sci-Fi",739881,2017-04-10,James Gunn
tt0389722,4,2021-09-19,30 Days of Night,https://www.imdb.com/title/tt0389722/,movie,6.6,113,2007,"Action, Horror, Thriller",185821,2007-10-16,David Slade
tt0389790,3,2015-01-25,Bee Movie,https://www.imdb.com/title/tt0389790/,movie,6.1,91,2007,"Animation, Adventure, Comedy, Drama, Family",175042,2007-10-28,"Simon J. Smith, Steve Hickner"
tt3915174,9,2023-05-21,Puss in Boots: The Last Wish,https://www.imdb.com/title/tt3915174/,movie,7.8,102,2022,"Animation, Adventure, Comedy, Family",159109,2022-12-07,"Januel Mercado, Joel Crawford"
tt3919922,4,2018-06-05,Epic Meal Empire,https://www.imdb.com/title/tt3919922/,tvSeries,6.5,,2014,Reality-TV,198,2014-07-26,
tt0395479,6,2015-09-04,Boundin',https://www.imdb.com/title/tt0395479/,short,6.9,5,2003,"Animation, Short, Comedy, Family, Musical",14568,2003-12-01,"Roger Gould, Bud Luckey"
tt0397306,9,2015-01-27,American Dad!,https://www.imdb.com/title/tt0397306/,tvSeries,7.4,22,2005,"Animation, Comedy",133699,2005-02-06,
tt0398286,8,2015-01-25,Tangled,https://www.imdb.com/title/tt0398286/,movie,7.7,100,2010,"Animation, Adventure, Comedy, Family, Fantasy, Musical, Romance",481068,2010-11-24,"Byron Howard, Nathan Greno"
tt4007502,6,2015-10-10,Frozen Fever,https://www.imdb.com/title/tt4007502/,short,6.8,8,2015,"Animation, Short, Adventure, Comedy, Family, Fantasy, Musical",17238,2015-03-12,"Jennifer Lee, Chris Buck"
