episode_name_number,episode,imdb_rating,season,season_ep_name
S18.E4 ∙ With a Little Help from My Friends,4,7.4,18,S18.E4: With a Little Help from My Friends
S18.E5 ∙ Bottle Up and Explode!,5,7.6,18,S18.E5: Bottle Up and Explode!
S18.E6 ∙ Every Day Is a Holiday (With You),6,7.2,18,S18.E6: Every Day Is a Holiday (With You)
S18.E7 ∙ Today Was a Fairytale,7,7.2,18,S18.E7: Today Was a Fairytale
S18.E8 ∙ It Came Upon a Midnight Clear,8,7.4,18,S18.E8: It Came Upon a Midnight Clear
S18.E9 ∙ No Time to Die,9,7.4,18,S18.E9: No Time to Die
S18.E10 ∙ Living in a House Divided,10,7.3,18,S18.E10: Living in a House Divided
S18.E11 ∙ Legacy,11,7.3,18,S18.E11: Legacy
S18.E12 ∙ The Makings of You,12,5.8,18,S18.E12: The Makings of You
S18.E13 ∙ Put the Squeeze on Me,13,7.3,18,S18.E13: Put the Squeeze on Me
S18.E14 ∙ Road Trippin',14,7.2,18,S18.E14: Road Trippin'
S18.E15 ∙ Put It to the Test,15,7.8,18,S18.E15: Put It to the Test
S18.E16 ∙ Should I Stay or Should I Go,16,7.1,18,S18.E16: Should I Stay or Should I Go
S18.E17 ∙ I'll Cover You,17,7.2,18,S18.E17: I'll Cover You
S18.E18 ∙ Stronger Than Hate,18,7.6,18,S18.E18: Stronger Than Hate
S18.E19 ∙ Out for Blood,19,7.7,18,S18.E19: Out for Blood
S18.E20 ∙ You Are the Blood,20,8.5,18,S18.E20: You Are the Blood
S19.E1 ∙ Everything Has Changed,1,7.7,19,S19.E1: Everything Has Changed
S19.E2 ∙ Wasn't Expecting That,2,7.5,19,S19.E2: Wasn't Expecting That
S19.E3 ∙ Let's Talk About Sex,3,7.4,19,S19.E3: Let's Talk About Sex
S19.E4 ∙ Haunted,4,7.1,19,S19.E4: Haunted
S19.E5 ∙ When I Get to the Border,5,7.5,19,S19.E5: When I Get to the Border
S19.E6 ∙ Thunderstruck,6,7.5,19,S19.E6: Thunderstruck
S19.E7 ∙ I'll Follow the Sun,7,6.3,19,S19.E7: I'll Follow the Sun
S19.E8 ∙ All Star,8,6.7,19,S19.E8: All Star
S19.E9 ∙ Love Don't Cost a Thing,9,6.6,19,S19.E9: Love Don't Cost a Thing
S19.E10 ∙ Sisters Are Doin' It for Themselves,10,7.1,19,S19.E10: Sisters Are Doin' It for Themselves
S19.E11 ∙ Training Day,11,7.3,19,S19.E11: Training Day
S19.E12 ∙ Pick Yourself Up,12,7.6,19,S19.E12: Pick Yourself Up
S19.E13 ∙ Cowgirls Don't Cry,13,7.2,19,S19.E13: Cowgirls Don't Cry
S19.E14 ∙ Shadow of Your Love,14,7.2,19,S19.E14: Shadow of Your Love
S19.E15 ∙ Mama Who Bore Me,15,7.1,19,S19.E15: Mama Who Bore Me
S19.E16 ∙ Gunpowder and Lead,16,7.3,19,S19.E16: Gunpowder and Lead
S19.E17 ∙ Come Fly With Me,17,7.6,19,S19.E17: Come Fly With Me
S19.E18 ∙ Ready to Run,18,7.4,19,S19.E18: Ready to Run
S19.E19 ∙ Wedding Bell Blues,19,7.7,19,S19.E19: Wedding Bell Blues
S19.E20 ∙ Happily Ever After?,20,8.2,19,S19.E20: Happily Ever After?
S20.E1 ∙ We've Only Just Begun,1,7.3,20,S20.E1: We've Only Just Begun
S20.E2 ∙ Keep the Family Close,2,7.2,20,S20.E2: Keep the Family Close
S20.E3 ∙ Walk on the Ocean,3,7.4,20,S20.E3: Walk on the Ocean
S20.E4 ∙ Baby Can I Hold You,4,7.4,20,S20.E4: Baby Can I Hold You
S20.E5 ∙ Never Felt So Alone,5,7.5,20,S20.E5: Never Felt So Alone
S20.E6 ∙ The Marathon Continues,6,7.3,20,S20.E6: The Marathon Continues
S20.E7 ∙ She Used to Be Mine,7,7.5,20,S20.E7: She Used to Be Mine
"S20.E8 ∙ Blood, Sweat and Tears",8,7.2,20,"S20.E8: Blood, Sweat and Tears"
S20.E9 ∙ I Carry Your Heart,9,7.5,20,S20.E9: I Carry Your Heart
S20.E10 ∙ Burn It Down,10,7.9,20,S20.E10: Burn It Down
